{
  "$schema": "https://json-schema.org/draft/2020-12/schema",
  "$id": "https://contracts.study2work.local/events/study-work/study.evidence.upserted.v1.schema.json",
  "title": "study.evidence.upserted.v1",
  "type": "object",
  "additionalProperties": false,
  "required": [
    "eventId",
    "eventType",
    "eventVersion",
    "occurredAt",
    "producer",
    "correlationId",
    "subject",
    "data"
  ],
  "properties": {
    "eventId": { "$ref": "#/$defs/uuid" },
    "eventType": { "const": "study.evidence.upserted.v1" },
    "eventVersion": { "const": 1 },
    "occurredAt": { "$ref": "#/$defs/isoDateTime" },
    "producer": { "const": "study-api" },
    "correlationId": { "$ref": "#/$defs/uuid" },
    "subject": {
      "type": "object",
      "additionalProperties": false,
      "required": ["platformUserId"],
      "properties": {
        "platformUserId": { "$ref": "#/$defs/uuid" }
      }
    },
    "data": {
      "type": "object",
      "additionalProperties": false,
      "required": [
        "sourceEvidenceId",
        "sourceVersion",
        "type",
        "title",
        "skillCodes",
        "level",
        "verified",
        "issuedAt",
        "verificationRef"
      ],
      "properties": {
        "sourceEvidenceId": { "$ref": "#/$defs/uuid" },
        "sourceVersion": { "type": "integer", "minimum": 1 },
        "type": {
          "type": "string",
          "enum": [
            "COURSE_COMPLETION",
            "ASSESSMENT_COMPLETION",
            "PROJECT_COMPLETION",
            "MENTOR_VERIFICATION",
            "SKILL_EVIDENCE"
          ]
        },
        "title": { "type": "string", "minLength": 1, "maxLength": 180 },
        "skillCodes": {
          "type": "array",
          "minItems": 1,
          "uniqueItems": true,
          "items": { "$ref": "#/$defs/skillCode" }
        },
        "level": {
          "type": "string",
          "enum": ["FOUNDATION", "INTERMEDIATE", "ADVANCED"]
        },
        "verified": { "type": "boolean" },
        "issuedAt": { "$ref": "#/$defs/isoDateTime" },
        "verificationRef": {
          "type": "string",
          "pattern": "^study:evidence:[0-9a-fA-F-]{36}$"
        },
        "metadata": {
          "type": "object",
          "additionalProperties": {
            "type": ["string", "number", "integer", "boolean", "null"]
          }
        }
      }
    }
  },
  "$defs": {
    "uuid": {
      "type": "string",
      "pattern": "^[0-9a-fA-F]{8}-[0-9a-fA-F]{4}-[0-9a-fA-F]{4}-[0-9a-fA-F]{4}-[0-9a-fA-F]{12}$"
    },
    "isoDateTime": {
      "type": "string",
      "pattern": "^\\d{4}-\\d{2}-\\d{2}T\\d{2}:\\d{2}:\\d{2}(\\.\\d{3})?Z$"
    },
    "skillCode": {
      "type": "string",
      "pattern": "^[a-z0-9]+(?:-[a-z0-9]+)*$",
      "minLength": 2,
      "maxLength": 64
    }
  }
}
